BibliographyType,ISBN,Identifier,Author,Title,Journal,Volume,Number,Month,Pages,Year,Address,Note,URL,Booktitle,Chapter,Edition,Series,Editor,Publisher,ReportType,Howpublished,Institution,Organizations,School,Annote,Custom1,Custom2,Custom3,Custom4,Custom5
7,"","Breheny2009","Breheny, P.; Huang, J.","Penalized methods for bi-level variable selection","Statistics and Its Interface",2,,"","369--380",2009,"","","http://intlpress.com/site/pub/pages/journals/items/sii/content/vols/0002/0003/a010/index.html","","","","","","","","","","","","","","","Grouping; PenalizedRegression","/iahome/p/pb/pbreheny/pdf/articles/Breheny2009.pdf",""
7,"","Breheny2003","Breheny, P. J.; Laederach, A.; Fulton, D. B.; Andreotti, A. H.","Ligand specificity modulated by prolyl imide bond cis/trans isomerization in the Itk SH2 domain: a quantitative NMR study","Journal of the American Chemical Society",125,51,"","15706--15707",2003,"","","http://pubs.acs.org/doi/abs/10.1021/ja0375380","","","","","","ACS Publications","","","","","","","","","Breheny","/iahome/p/pb/pbreheny/pdf/articles/Breheny2003.pdf",""
7,"","Gfeller2008","Gfeller, K.; Oleson, J.; Knutson, J. F.; Breheny, P.; Driscoll, V.; Olszewski, C.","Multivariate predictors of music perception and appraisal by adult cochlear implant users","Journal of the American Academy of Audiology",19,2,"","120",2008,"","","http://www.ingentaconnect.com/content/aaa/jaaa/2008/00000019/00000002/art00003?token=0059169ff49f676720297d7634447b2e7b6c7a737b4235206d3f6a4b4b6e6e42576b642738201ffe515cbac77","","","","","","","","","","","","","","","Application","/iahome/p/pb/pbreheny/pdf/articles/Gfeller2008.pdf",""
7,"","Oleson2008","Oleson, J. J.; Breheny, P. J.; Pendergast, J. F.; Ryan, S.; Litchfield, R.","Impact of travel distance on WISEWOMAN Intervention attendance for a rural population","Preventive Medicine",47,5,"","565--569",2008,"","","http://www.sciencedirect.com/science/article/pii/S0091743508003472","","","","","","Elsevier","","","","","","","","","Smoothing; Application","/iahome/p/pb/pbreheny/pdf/articles/Oleson2008.pdf",""
7,"","Gode-Potratz2011","Gode-Potratz, C. J.; Kustusch, R. J.; Breheny, P. J.; Weiss, D. S.; McCarter, L. L.","Surface sensing in Vibrio parahaemolyticus triggers a programme of gene expression that promotes colonization and virulence","Molecular Microbiology",79,1,"","240--263",2011,"","","http://dx.doi.org/10.1111/j.1365-2958.2010.07445.x","","","","","","","","","","","","","","","Breheny","/iahome/p/pb/pbreheny/pdf/articles/Gode-Potratz2011.pdf",""
7,"","Breheny2011","Breheny, Patrick; Huang, Jian","Coordinate descent algorithms for nonconvex penalized regression, with applications to biological feature selection","Annals of Applied Statistics",5,1,"","232--253",2011,"","","http://dx.doi.org/10.1214/10-AOAS388","","","","","","","","","","","","","","","","/iahome/p/pb/pbreheny/pdf/articles/Breheny2011.pdf",""
7,"","Fardo2011","Fardo, David; Druen, Anthony; Liu, Jinze; Mirea, Lucia; Infante-Rivard, Claire; Breheny, Patrick","Exploration and comparison of methods for combining population- and family-based genetic association using the Genetic Analysis Workshop 17 mini-exome","BMC Proceedings",5,Suppl 9,"","S28",2011,"","","http://www.biomedcentral.com/1753-6561/5/S9/S28","","","","","","","","","","","","","","","Genetics","/iahome/p/pb/pbreheny/pdf/articles/Fardo2011.pdf",""
7,"","Podzielinski2012","Podzielinski, Iwona; Randall, Marcus E.; Breheny, Patrick J.; Escobar, Pedro F.; Cohn, David E.; Quick, Allison M.; Chino, Junzo P.; Lopez-Acevedo, Micael; Seitz, Jana L.; Zook, Jennifer E.; Seamon, Leigh G.","Primary radiation therapy for medically inoperable patients with clinical stage I and II endometrial carcinoma","Gynecologic Oncology",124,1,"","36--41",2012,"","","http://www.sciencedirect.com/science/article/pii/S009082581100792X","","","","","","","","","","","","","","","Breheny","/iahome/p/pb/pbreheny/pdf/articles/Podzielinski2012.pdf",""
7,"","Srinivasan2012","Srinivasan, Jayaram; Breheny, Patrick J.","Meditation for Quality Improvement of Medical Encounters: Single-Intervention, Vedanta-Based Meditation Effects on Vital Signs and Mood Indices","Journal of Evidence-Based Complementary \& Alternative Medicine",17,2,"","96-103",2012,"","","http://chp.sagepub.com/content/17/2/96.abstract","","","","","","","","","","","","","","","Breheny","/iahome/p/pb/pbreheny/pdf/articles/Srinivasan2012.pdf",""
7,"","Breheny2012","Breheny, Patrick; Chalise, Prabhakar; Batzler, Anthony; Wang, Liewei; Fridley, Brooke L.","Genetic Association Studies of Copy-Number Variation: Should Assignment of Copy Number States Precede Testing?","PLoS ONE",7,4,"04","e34262",2012,"","","http://dx.doi.org/10.1371%2Fjournal.pone.0034262","","","","","","Public Library of Science","","","","","","","","","Breheny; CNV;","/iahome/p/pb/pbreheny/pdf/articles/Breheny2012.pdf",""
7,"","Nickell2012","Nickell, Melissa D.; Breheny, Patrick; Stromberg, Arnold J.; McClintock, Timothy S.","Genomics of mature and immature olfactory sensory neurons","Journal of Comparative Neurology",520,12,"","2608--2629",2012,"","","http://dx.doi.org/10.1002/cne.23052","","","","","","Wiley Subscription Services, Inc., A Wiley Company","","","","","","","","","Breheny","/iahome/p/pb/pbreheny/pdf/articles/Nickell2012.pdf",""
7,"","Smith2012","Smith, Kathryn L.; Li, Yanqiu; Breheny, Patrick; Cook, R. Frank; Henney, Pamela J.; Sells, Stephen; Pronost, St{\'e}phane; Lu, Zhengchun; Crossley, Beate M.; Timoney, Peter J.; Balasuriya, Udeni B. R.","New Real-Time PCR Assay Using Allelic Discrimination for Detection and Differentiation of Equine Herpesvirus-1 Strains with $A_2254$ and $G_2254$ Polymorphisms","Journal of Clinical Microbiology",50,6,"","1981-1988",2012,"","","http://jcm.asm.org/content/50/6/1981.abstract","","","","","","","","","","","","","","","Breheny","/iahome/p/pb/pbreheny/pdf/articles/Smith2012.pdf",""
7,"","Huang2012","Huang, Jian; Breheny, Patrick; Ma, Shuangge","A Selective Review of Group Selection in High-Dimensional Models","Statistical Science",27,,"","481-499",2012,"","","http://dx.doi.org/10.1214/12-STS392","","","","","","","","","","","","","","","Grouping; PenalizedRegression","/iahome/p/pb/pbreheny/pdf/articles/Huang2012.pdf",""
7,"","Scott2012","Scott, Shaunna L.; McSpirit, Stephanie; Breheny, Patrick; Howell, Britteny M.","The Long-Term Effects of a Coal Waste Disaster on Social Trust in Appalachian Kentucky","Organization \& Environment",25,4,"","402-418",2012,"","","http://oae.sagepub.com/content/25/4/402.abstract","","","","","","","","","","","","","","","","/iahome/p/pb/pbreheny/pdf/articles/Scott2012.pdf",""
7,"","Owen2013","Owen, Chelsea; Breheny, Patrick; Ingram, Richard; Pfeifle, William; Cain, Jeff; Ryan, Melody","Factors Associated With Pharmacy Student Interest in International Study","American Journal of Pharmaceutical Education",77,3,"Apr","54",2013,"","","http://dx.doi.org/10.5688/ajpe77354","","","","","","American Association of Colleges of Pharmacy","","","","","","","","","","/iahome/p/pb/pbreheny/pdf/articles/Owen2013.pdf",""
7,"","Breheny2012a","Breheny, Patrick; Li, Yinglei; Charnigo, Richard","Statistical Challenges and Opportunities in Copy Number Variant Association Studies","Journal of Biometrics \& Biostatistics",3,7,"","e118",2012,"","","http://www.omicsonline.org/2155-6180/2155-6180-3-e118.php","","","","","","OMICS Group Inc.,","","","","","","","","","","/iahome/p/pb/pbreheny/pdf/articles/Breheny2012a.pdf",""
7,"","Li2013","Li, Yinglei; Breheny, Patrick","Kernel-Based Aggregation of Marker-Level Genetic Association Tests Involving Copy-Number Variation","Microarrays",2,3,"","265--283",2013,"","","http://www.mdpi.com/2076-3905/2/3/265","","","","","","","","","","","","","","","CNV;","/iahome/p/pb/pbreheny/pdf/articles/Li2013.pdf",""
7,"","Heron2013","Heron, Paula; Stromberg, Arnold; Breheny, Patrick; McClintock, Timothy","Molecular events in the cell types of the olfactory epithelium during adult neurogenesis","Molecular Brain",6,1,"","49",2013,"","","http://www.molecularbrain.com/content/6/1/49","","","","","","","","","","","","","","","","/iahome/p/pb/pbreheny/pdf/articles/Heron2013.pdf",""
7,"","Laham2014","Laham, James L.; Breheny, Patrick J.; Gardner, Brian M.; Bada, Henrietta","Procalcitonin to Predict Bacterial Coinfection in Infants With Acute Bronchiolitis: A Preliminary Analysis","Pediatric Emergency Care",30,1,"","11--15",2014,"","","http://journals.lww.com/pec-online/Fulltext/2014/01000/Procalcitonin_to_Predict_Bacterial_Coinfection_in.3.aspx","","","","","","","","","","","","","","","","/iahome/p/pb/pbreheny/pdf/articles/Laham2014.pdf",""
7,"","Crawford2014","Crawford, Timothy N.; Sanderson, Wayne T.; Breheny, Patrick; Fleming, Steven T.; Thornton, Alice","Impact of Non-HIV Related Comorbidities on Retention in HIV Medical Care: Does Retention Improve Over Time?","AIDS and Behavior",18,3,"","617-624",2014,"","","http://dx.doi.org/10.1007/s10461-013-0524-y","","","","","","Springer US","","","","","","","","","","",""
7,"","BrehenyR2014","Breheny, Patrick","Review of \emphGenomic Clinical Trials and Predictive Medicine, by Richard Simon","Journal of the American Statistical Association",109,,"","868-869",2014,"","","http://www.tandfonline.com/doi/full/10.1080/01621459.2014.930290#.VA845tbtB0w","","","","","","","","","","","","","","","","",""
7,"","SchofieldR2014","Schofield, Matthew; Breheny, Patrick","Review of \emphThe BUGS Book: A Practical Introduction to Bayesian Analysis, by David Lunn et al.","The American Statistician",60,,"","63",2014,"","","http://www.tandfonline.com/eprint/XdaFcqG7M4v9SChENbeM/full","","","","","","","","","","","","","","","","",""
7,"","Stokes2014","Stokes, Sean; Breheny, Patrick; Radulescu, Aurelia; Radulescu, Vlad Calin","Impact of Obesity on the Risk of Venous Thromboembolism in an Inpatient Pediatric Population","Pediatric Hematology-Oncology",31,5,"","475-480",2014,"","","http://dx.doi.org/10.3109/08880018.2014.886315","","","","","","","","","","","","","","","","/iahome/p/pb/pbreheny/pdf/articles/Stokes2014.pdf",""
7,"","McClintock2014","McClintock, Timothy S.; Adipietro, Kaylin; Titlow, William B.; Breheny, Patrick; Walz, Andreas; Mombaerts, Peter; Matsunami, Hiroaki","\emphIn Vivo identification of eugenol-responsive and muscone-responsive mouse odorant receptors","The Journal of Neuroscience",34,47,"","15669--15678",2014,"","","http://www.jneurosci.org/content/34/47/15669.abstract","","","","","","","","","","","","","","","","",""
7,"","Bada2015","Bada, Henrietta; Sithisarn, Thitinart; Gibson, Julia; Garlitz, Karen; Caldwell, Rhonda; Capilouto, Gilson; Li, Yinglei; Leggas, Markos; Breheny, Patrick","Morphine versus Clonidine for Neonatal Abstinence Syndrome","Pediatrics",135,2,"","e383-e391",2015,"","","http://pediatrics.aappublications.org/content/early/2015/01/20/peds.2014-2377.abstract","","","","","","","","","","","","","","","","",""
7,"","Miller2015","Miller, Michael; Ma, Deqin; Schappet, James; Breheny, Patrick; Mott, Sarah; Bannick, Nadine; Askeland, Eric; Brown, James; Henry, Michael","Downregulation of dystroglycan glycosyltransferases LARGE2 and ISPD associate with increased mortality in clear cell renal cell carcinoma","Molecular Cancer",14,1,"","141",2015,"","","http://www.molecular-cancer.com/content/14/1/141","","","","","","","","","","","","","","","","/iahome/p/pb/pbreheny/pdf/articles/Miller2015.pdf",""
7,"","Hovey2015","Hovey, Adriann M.; Devor, Eric J.; Breheny, Patrick J.; Mott, Sarah L.; Dai, Donghai; Thiel, Kristina W.; Leslie, Kimberly K.","miR-888: A Novel Cancer-Testis Antigen that Targets the Progesterone Receptor in Endometrial Cancer","Translational Oncology",8,2,"","85 - 96",2015,"","","http://www.sciencedirect.com/science/article/pii/S1936523315000054","","","","","","","","","","","","","","","","",""
7,"","Sanz2013","Sanz, M.; Loynachan, A.; Sun, L.; Oliveira, A.; Breheny, P.; Horohov, D. W.","The effect of bacterial dose and foal age at challenge on Rhodococcus equi infection","Veterinary Microbiology",167,0,"","623--631",2013,"","","http://www.sciencedirect.com/science/article/pii/S0378113513004574","","","","","","","","","","","","","","","","/iahome/p/pb/pbreheny/pdf/articles/Sanz2013.pdf",""
7,"","Vanderpool2015","Vanderpool, Robin C.; Breheny, Patrick J.; Tiller, Peggy A.; Huckelby, Carol A.; Edwards, Amy D.; Upchurch, Kristi D.; Phillips, Cynthia A.; Weyman, Christine F.","Implementation and Evaluation of a School-Based Human Papillomavirus Vaccination Program in Rural Kentucky","American Journal of Preventive Medicine",49,2,"","317 - 323",2015,"","","http://www.sciencedirect.com/science/article/pii/S0749379715002214","","","","","","","","","","","","","","","","",""
7,"","Breheny2015","Breheny, Patrick; Huang, Jian","Group descent algorithms for nonconvex penalized linear and logistic regression models with grouped predictors","Statistics and Computing",25,2,"","173-187",2015,"","","http://dx.doi.org/10.1007/s11222-013-9424-2","","","","","","Springer US","","","","","","","","","Optimization; Penalized regression; Group lasso; Descent algorithms","/iahome/p/pb/pbreheny/pdf/articles/Breheny2015.pdf",""
7,"","BrehenyR2011","Breheny, Patrick","Review of \emphIntuitive Biostatistics, by Harvey Motulsky","The American Statistician",65,,"","67-68",2011,"","","http://amstat.tandfonline.com/doi/abs/10.1198/tast.2010.br651#.UrR0bfhY1ko","","","","","","","","","","","","","","","","",""
13,"","Huang2010u","Huang, Jian; Breheny, Patrick; Ma, Shuangge; Zhang, Cun-Hui","The Mnet Method for Variable Selection","University of Iowa, Department of Statistics and Actuarial Sciences",402,\#402,"","",2010,"","\url{http://www.stat.uiowa.edu/sites/default/files/techrep/tr402.pdf}","","","","","","","","","","University of Iowa, Department of Statistics \& Actuarial Sciences","","University of Iowa, Department of Statistics \& Actuarial Sciences","","","","","",""
7,"","Laham2015","Laham, James L.; Breheny, Patrick J.; Rush, Amanda","Do Clinical Parameters Predict First Planned Extubation Outcome in the Pediatric Intensive Care Unit?","Journal of Intensive Care Medicine",30,2,"","89-96",2015,"","","http://jic.sagepub.com/content/30/2/89.abstract","","","","","","","","","","","","","","","","/iahome/p/pb/pbreheny/pdf/articles/Laham2015.pdf",""
7,"","Spracklen2015","Spracklen, Cassandra N.; Saftlas, Audrey F.; Triche, Elizabeth W.; Bjonnes, Andrew; Keating, Brendan; Saxena, Richa; Breheny, Patrick J.; Dewan, Andrew T.; Robinson, Jennifer G.; Hoh, Josephine; Ryckman, Kelli K.","Genetic Predisposition to Dyslipidemia and Risk of Preeclampsia","American Journal of Hypertension",28,7,"","915-923",2015,"","","http://ajh.oxfordjournals.org/content/28/7/915.abstract","","","","","","","","","","","","","","","","",""
7,"","Yi2015","Yi, Hui; Breheny, Patrick; Imam, Netsanet; Liu, Yongmei; Hoeschele, Ina","Penalized multimarker vs. single-marker regression methods for genome-wide association studies of quantitative traits","Genetics",199,1,"","205-222",2015,"","","http://www.genetics.org/content/199/1/205.abstract","","","","","","","","","","","","","","","","",""
7,"","Smith2016","Smith, Caitlin J.; Saftlas, Audrey F.; Spracklen, Cassandra N.; Triche, Elizabeth W.; Bjonnes, Andrew; Keating, Brendan; Saxena, Richa; Breheny, Patrick J.; Dewan, Andrew T.; Robinson, Jennifer G.; Hoh, Josephine; Ryckman, Kelli K.","Genetic risk score for essential hypertension and risk of preeclampsia","American Journal of Hypertension",29,1,"","17-24",2016,"","","http://ajh.oxfordjournals.org/content/29/1/17.abstract","","","","","","","","","","","","","","","","/iahome/p/pb/pbreheny/pdf/articles/Smith2016.pdf",""
7,"","Campos2014","Campos, Juliana R.; Breheny, Patrick; Araujo, Reno R.; Troedsson, Mats H. T.; Squires, Edward L.; Timoney, Peter J.; Balasuriya, Udeni B. R.","Semen quality of stallions challenged with the Kentucky 84 strain of equine arteritis virus","Theriogenology",82,8,"","1068 - 1079",2014,"","","http://www.sciencedirect.com/science/article/pii/S0093691X14003458","","","","","","","","","","","","","","","","/iahome/p/pb/pbreheny/pdf/articles/Campos2014.pdf",""
7,"","Huang2016","Huang, Jian; Breheny, Patrick; Lee, Sangin; Ma, Shuangge; Zhang, Cun-Hui","The Mnet method for variable selection","Statistica Sinica",26,3,"","903-923",2016,"","","http://www3.stat.sinica.edu.tw/statistica/J26N3/J26N32/J26N32.html","","","","","","","","","","","","","","","","/iahome/p/pb/pbreheny/pdf/articles/Huang2016.pdf",""
7,"","Singleton2016","Singleton, Michael D.; Breheny, Patrick J.","Nonlinear hierarchical modeling of experimental infection data","Preventive Veterinary Medicine",130,,"","129 - 136",2016,"","","http://www.sciencedirect.com/science/article/pii/S0167587716301751","","","","","","","","","","","","","","","","/iahome/p/pb/pbreheny/pdf/articles/Singleton2016.pdf",""
7,"","Zeng2016","Zeng, Yaohui; Breheny, Patrick","Overlapping group logistic regression with applications to genetic pathway selection","Cancer Informatics",15,,"09","179--187",2016,"","","http://www.la-press.com/overlapping-group-logistic-regression-with-applications-to-genetic-pat-article-a5904","","","","","","Libertas Academica","","","","","","","","","","",""
7,"","Spracklen2017","Spracklen, Cassandra N.; Smith, Caitlin J.; Saftlas, Audrey F.; Triche, Elizabeth W.; Bjonnes, Andrew; Keating, Brendan J.; Saxena, Richa; Breheny, Patrick J.; Dewan, Andrew T.; Robinson, Jennifer G.; Hoh, Josephine; Ryckman, Kelli K.","Genetic predisposition to elevated levels of C-reactive protein is associated with a decreased risk for preeclampsia","Hypertension in Pregnancy",36,1,"","30-35",2017,"","PMID: 27657194","http://dx.doi.org/10.1080/10641955.2016.1223303","","","","","","","","","","","","","","","","",""
7,"","Pashkova2016","Pashkova, Natasha; Peterson, Tabitha; Krishnamani, Venkatramanan; Breheny, Patrick; Stamnes, Mark; Piper, Robert","DEEPN as an approach for batch processing of yeast 2-hybrid interactions","Cell Reports",17,1,"","303--315",2016,"","","http://dx.doi.org/10.1016/j.celrep.2016.08.095","","","","","","Elsevier","","","","","","","","","","/iahome/p/pb/pbreheny/pdf/articles/Pashkova2016.pdf",""
7,"","Breheny2015a","Breheny, Patrick","The group exponential lasso for bi-level variable selection","Biometrics",71,3,"","731--740",2015,"","","http://dx.doi.org/10.1111/biom.12300","","","","","","","","","","","","","","","Group variable selection, Penalized regression, Rare variants","/iahome/p/pb/pbreheny/pdf/articles/Breheny2015a.pdf",""
7,"","Hill-Burns2016","Hill-Burns, Erin M.; Ross, Owen A.; Wissemann, William T.; Soto-Ortolaza, Alexandra I.; Zareparsi, Sepideh; Siuda, Joanna; Lynch, Timothy; Wszolek, Zbigniew K.; Silburn, Peter A.; Mellick, George D.; Ritz, Beate; Scherzer, Clemens R.; Zabetian, Cyrus P.; Factor, Stewart A.; Breheny, Patrick J.; Payami, Haydeh","Identification of genetic modifiers of age-at-onset for familial Parkinson's disease","Human Molecular Genetics",25,17,"","3849",2016,"","","http://dx.doi.org/10.1093/hmg/ddw206","","","","","","","","","","","","","","","","/iahome/p/pb/pbreheny/pdf/articles/Hill-Burns2016.pdf",""
7,"","Lee2015a","Lee, Sangin; Breheny, Patrick","Strong Rules for Nonconvex Penalties and Their Implications for Efficient Algorithms in High-Dimensional Regression","Journal of Computational and Graphical Statistics",24,4,"","1074-1091",2015,"","","http://dx.doi.org/10.1080/10618600.2014.975231","","","","","","","","","","","","","","","","",""
7,"","Graham2017","Graham, Michael M.; Gu, Xiaomei; Ginader, Timothy; Breheny, Patrick; Sunderland, John J.","68Ga-DOTATOC imaging of neuroendocrine tumors: A systematic review and metaanalysis","Journal of Nuclear Medicine",58,9,"","1452-1458",2017,"","","http://jnm.snmjournals.org/content/58/9/1452.abstract","","","","","","","","","","","","","","","","",""
14,"","ZengHSSR","Zeng, Yaohui; Breheny, Patrick; Yang, Tianbao","Efficient feature screening for lasso-type problems via hybrid safe-strong rules","",,,"","",In submission,"","\quad","","","","","","","","","","","","","","","","","",""
7,"","Keck2017","Keck, Kendall J.; Choi, Allen; Maxwell, Jessica E.; Li, Guiying; O'Dorisio, Thomas M.; Breheny, Patrick; Bellizzi, Andrew M.; Howe, James R.","Increased grade in neuroendocrine tumor metastases negatively impacts survival","Annals of Surgical Oncology",24,8,"Aug","2206--2212",2017,"","","https://doi.org/10.1245/s10434-017-5899-y","","","","","","","","","","","","","Tumor grade is an important predictor of survival in gastroenteropancreatic (GEP) neuroendocrine tumors (NETs), as determined by Ki-67 expression and mitotic rate. NETs generally grow indolently, but some cells may acquire traits facilitating metastasis. It is unclear how frequently metastases differ in grade from their primary tumors, and whether increasing grade in metastases affects prognosis.","","","/iahome/p/pb/pbreheny/pdf/articles/Keck2017.pdf",""
7,"","Chau2017","Chau, Destiny.; Reddy, Arundathi.; Breheny, Patrick.; Young, Anna.; Ashford, Eric.; Song, Megan.; Zhang, Christina.; Taylor, Tammy.; Younes, Abbas.; Vazifedan, Turaj.","Revisiting the applicability of adult early post-operative nausea and vomiting risk factors for the paediatric patient: A prospective study using cotinine levels in children undergoing adenotonsillectomies","Indian Journal of Anaesthesia",61,12,"","964-971",2017,"","","http://www.ijaweb.org/article.asp?issn=0019-5049;year=2017;volume=61;issue=12;spage=964;epage=971;aulast=Chau;t=6","","","","","","","","","","","","","","","","/iahome/p/pb/pbreheny/pdf/articles/Chau2017.pdf",""
7,"","Keck2018","Keck, Kendall J.; Breheny, Patrick; Braun, Terry A.; Darbro, Benjamin; Li, Guiying; Dillon, Joseph S.; Bellizzi, Andrew M.; O'Dorisio, Thomas M.; Howe, James R.","Changes in gene expression in small bowel neuroendocrine tumors associated with progression to metastases","Surgery",163,1,"","232 - 239",2018,"","","http://www.sciencedirect.com/science/article/pii/S0039606017306141","","","","","","","","","","","","","","","","/iahome/p/pb/pbreheny/pdf/articles/Keck2018.pdf",""
14,"","ZengBigLasso","Zeng, Yaohui; Breheny, Patrick","The biglasso package: A memory- and computation-efficient solver for lasso model fitting with big data in R","",,,"","",In submission,"","\quad","","","","","","","","","","","","","","","","","",""
7,"","Breheny2017","Breheny, Patrick; Burchett, Woodrow","Visualization of regression models using \textttvisreg","The {R} Journal",9,2,"","56--71",2017,"","","https://journal.r-project.org/archive/2017/RJ-2017-046/index.html","","","","","","","","","","","","","","","","",""
7,"","Zhang2018","Zhang, Xiaoming; Yoon, Jin-Young; Morley, Michael; McLendon, Jared M.; Mapuskar, Kranti A.; Gutmann, Rebecca; Mehdi, Haider; Bloom, Heather L.; Dudley, Samuel C.; Ellinor, Patrick T.; Shalaby, Alaa A.; Weiss, Raul; Tang, W. H. Wilson; Moravec, Christine S.; Singh, Madhurmeet; Taylor, Anne L.; Yancy, Clyde W.; Feldman, Arthur M.; McNamara, Dennis M.; Irani, Kaikobad; Spitz, Douglas R.; Breheny, Patrick; Margulies, Kenneth B.; London, Barry; Boudreau, Ryan L.","A common variant alters SCN5A--miR-24 interaction and associates with heart failure mortality","The Journal of Clinical Investigation",128,3,"3","1154-1163",2018,"","","https://www.jci.org/articles/view/95710","","","","","","The American Society for Clinical Investigation","","","","","","","","","","",""
14,"","local-mfdr","Miller, Ryan; Breheny, Patrick","Feature-specific inference for penalized regression using local false discovery rates","",,,"","",In submission,"","\quad","","","","","","","","","","","","","","","","","",""
7,"","Donovan2018","Donovan, Brittney M.; Ryckman, Kelli K.; Breheny, Patrick J.; Gebretsadik, Tebeb; Turi, Kedir N.; Larkin, Emma K.; Li, Yinmei; Dorley, Mary C.; Hartert, Tina V.","Association of newborn screening metabolites with risk of wheezing in childhood","Pediatric Research",84,5,"","619--624",2018,"","","https://doi.org/10.1038/s41390-018-0070-4","","","","","","","","","","","","","There are critical gaps in our understanding of the temporal relationships between metabolites and subsequent asthma development. This is the first study to examine metabolites from newborn screening in the etiology of early childhood wheezing.","","","",""
7,"","Breheny2018","Breheny, Patrick; Stromberg, Arnold; Lambert, Joshua","$p$-value histograms: Inference and diagnostics","High-Throughput",7,3,"","1--13",2018,"","","http://www.mdpi.com/2571-5135/7/3/23","","","","","","","","","","","","","","","","",""
7,"","Scott2019","Scott, Aaron T.; Breheny, Patrick J.; Keck, Kendall J.; Bellizzi, Andrew M.; Dillon, Joseph S.; O'Dorisio, Thomas M.; Howe, James R.","Effective cytoreduction can be achieved in patients with numerous neuroendocrine tumor liver metastases (NETLMs)","Surgery",165,1,"","166 - 175",2019,"","","http://www.sciencedirect.com/science/article/pii/S0039606018305397","","","","","","","","","","","","","","","","",""
7,"","Smith2018","Smith, Caitlin J.; Baer, Rebecca J.; Oltman, Scott P.; Breheny, Patrick J.; Bao, Wei; Robinson, Jennifer G.; Dagle, John M.; Liang, Liang; Feuer, Sky K.; Chambers, Christina D.; Jelliffe-Pawlowski, Laura L.; Ryckman, Kelli K.","Maternal dyslipidemia and risk for preterm birth","PLOS ONE",13,12,"12","1-10",2018,"","","https://doi.org/10.1371/journal.pone.0209579","","","","","","Public Library of Science","","","","","","","","","","",""
