BibliographyType,ISBN,Identifier,Author,Title,Journal,Volume,Number,Month,Pages,Year,Address,Note,URL,Booktitle,Chapter,Edition,Series,Editor,Publisher,ReportType,Howpublished,Institution,Organizations,School,Annote,Custom1,Custom2,Custom3,Custom4,Custom5
7,"","Donovan2019","Donovan, Brittney M.; Breheny, Patrick J.; Robinson, Jennifer G.; Baer, Rebecca J.; Saftlas, Audrey F.; Bao, Wei; Greiner, Andrea L.; Carter, Knute D.; Oltman, Scott P.; Rand, Larry; Jelliffe-Pawlowski, Laura L.; Ryckman, Kelli K.","Development and validation of a clinical model for preconception and early pregnancy risk prediction of gestational diabetes mellitus in nulliparous women","PLOS ONE",14,4,"04","1-21",2019,"","","https://doi.org/10.1371/journal.pone.0215173","","","","","","Public Library of Science","","","","","","","","","","",""
7,"","Huusko2018","Huusko, Johanna M.; Karjalainen, Minna K.; Graham, Britney E.; Zhang, Ge; Farrow, Emily G.; Miller, Neil A.; Jacobsson, Bo; Eidem, Haley R.; Murray, Jeffrey C.; Bedell, Bruce; Breheny, Patrick; Brown, Noah W.; Bødker, Frans L.; Litterman, Nadia K.; Jiang, Pan-Pan; Russell, Laura; Hinds, David A.; Hu, Youna; the 23andMe Research Team; Rokas, Antonis; Teramo, Kari; Christensen, Kaare; Williams, Scott M.; Rämet, Mika; Kingsmore, Stephen F.; Ryckman, Kelli K.; Hallman, Mikko; Muglia, Louis J.","Whole exome sequencing reveals HSPA1L as a genetic risk factor for spontaneous preterm birth","PLOS Genetics",14,7,"07","1-22",2018,"","","https://doi.org/10.1371/journal.pgen.1007394","","","","","","Public Library of Science","","","","","","","","","","",""
14,"","DaiCoxCV","Dai, Biyue; Breheny, Patrick","Cross validation approaches for penalized Cox regression","",,,"","",In submission,"","\quad","","","","","","","","","","","","","","","","","",""
7,"","Smith2019","Smith, Caitlin J.; Jasper, Elizabeth A.; Baer, Rebecca J.; Breheny, Patrick J.; Paynter, Randi A.; Bao, Wei; Robinson, Jennifer G.; Dagle, John M.; Jelliffe-Pawlowski, Laura L.; Ryckman, Kelli K.","Genetic Risk Scores for Maternal Lipid Levels and Their Association with Preterm Birth","Lipids",54,10,"","641-650",2019,"","","https://aocs.onlinelibrary.wiley.com/doi/abs/10.1002/lipd.12186","","","","","","","","","","","","","","","Association, Genetic risk score, Lipids, Pregnancy, Preterm birth","",""
7,"","Schafer2017","Schafer, Ellen J.; Campo, Shelly; Colaizy, Tarah T.; Mulder, Pamela J.; Breheny, Patrick; Ashida, Sato","First-time mothers’ breast-feeding maintenance: role of experiences and changes in maternal perceptions","Public Health Nutrition",20,17,"","3099--3108",2017,"","","https://doi.org/10.1017/S136898001700221X","","","","","","Cambridge University Press","","","","","","","","","","",""
7,"","Liu2020","Liu, Huan; Duncan, Kaylia; Helverson, Annika; Kumari, Priyanka; Mumm, Camille; Xiao, Yao; Carlson, Jenna Colavincenzo; Darbellay, Fabrice; Visel, Axel; Leslie, Elizabeth; Breheny, Patrick; Erives, Albert J.; Cornell, Robert A.","Analysis of zebrafish periderm enhancers facilitates identification of a regulatory variant near human \textitKRT8/18","eLife",9,,"feb","e51325",2020,"","","https://doi.org/10.7554/eLife.51325","","","","","Bronner, Marianne E.","eLife Sciences Publications, Ltd","","","","","","","","","","",""
7,"","Scott2020","Scott, Aaron T.; Weitz, Michelle; Breheny, Patrick J.; Ear, Po Hien; Darbro, Benjamin; Brown, Bart J.; Braun, Terry A.; Li, Guiying; Umesalma, Shaikamjad; Kaemmer, Courtney A.; Maharjan, Chandra K.; Quelle, Dawn E.; Bellizzi, Andrew M.; Chandrasekharan, Chandrikha; Dillon, Joseph S.; O{\textquoteright}Dorisio, Thomas M.; Howe, James R.","Gene expression signatures identify novel therapeutics for metastatic pancreatic neuroendocrine tumors","Clinical Cancer Research",,,"","",2020,"","","https://clincancerres.aacrjournals.org/content/early/2020/03/05/1078-0432.CCR-19-2884","","","","","","American Association for Cancer Research","","","","","","","","","","",""
7,"","March2020","de March, Claire A.; Titlow, William B.; Sengoku, Tomoko; Breheny, Patrick; Matsunami, Hiroaki; McClintock, Timothy S.","Modulation of the combinatorial code of odorant receptor response patterns in odorant mixtures","Molecular and Cellular Neuroscience",104,,"","103469",2020,"","","http://www.sciencedirect.com/science/article/pii/S1044743119302969","","","","","","","","","","","","","","","Olfactory coding, Olfactory sensory neurons, G protein-coupled receptors, Olfaction","",""
7,"","Breheny2019","Breheny, Patrick J.","Marginal false discovery rates for penalized regression models","Biostatistics",20,2,"02","299-314",2019,"","","https://dx.doi.org/10.1093/biostatistics/kxy004","","","","","","","","","","","","","","","","",""
7,"","Miller2019","Miller, Ryan E.; Breheny, Patrick","Marginal false discovery rate control for likelihood-based penalized regression models","Biometrical Journal",61,4,"","889-901",2019,"","","https://onlinelibrary.wiley.com/doi/abs/10.1002/bimj.201800138","","","","","","","","","","","","","","","Cox regression, false discovery rates, generalized linear models, high-dimensional data analysis, lasso, penalized regression","",""
